{
  "id": 41373230,
  "name": "Bastard the Ashen Dragon",
  "is_illegal": false,
  "text": "\"Albus the Nullius Filius\" + 1 monster with 2500 or more ATK\nGains ATK equal to the combined original Levels of the materials used for its Fusion Summon x 100. After this card is Fusion Summoned, for the rest of this turn, it is unaffected by the activated effects of other monsters that were Special Summoned from the Extra Deck. During the End Phase, if this card is in your GY because it was sent there this turn: You can take 1 \"Dragma\" monster or 1 \"Albus the Nullius Filius\" from your Deck, and either add it to your hand or Special Summon it. You can only use this effect of \"Bastard the Ashen Dragon\" once per turn.",
  "images": [
    "https://storage.googleapis.com/ygoprodeck.com/pics/41373230.jpg"
  ],
  "type": "Monster",
  "attribute": "DARK",
  "atk": 2500,
  "species": "Dragon",
  "monster_type": "Fusion",
  "is_pendulum": false,
  "ability": "",
  "has_effect": true,
  "def": 2500,
  "level": 8,
  "is_tuner": false
}